{
  "schemaVersion": 1,
  "platformProfile": "static",
  "foundation": "static",
  "runtime": "static",
  "source": {
    "repository": "https://github.com/Vermeulen-Solutions/emdash-baseline",
    "commit": "2fc9774ba30a4d38defbf2ce92270628993d2750",
    "release": null
  },
  "generatorVersion": "0.3.0",
  "features": [],
  "checks": [
    "lint",
    "check:art-direction",
    "design:tokens",
    "test",
    "typecheck",
    "build",
    "check:release-artifact",
    "check:dev-tools"
  ],
  "skills": [
    "new-site-workflow",
    "site-art-direction",
    "astro-site-design",
    "impeccable"
  ]
}
